{
  "schema_version": "1.0",
  "issue_id": "SP-2022-Y",
  "evidence_task_id": "evidence:SP-2022-Y:series-openai-whisper-2022-a64641ea5e",
  "evidence_task_sha256": "32cb173725a189ebd1aad70bd3abb3b5f75e3f12daa41ae3becb09e76c11ad13",
  "prompt_id": "primary-source-verification-v0.1",
  "prompt_sha256": "c76baafb0bfdc1d3b3f859aec7f878a43e88372690055599f7317aaba9dde08a",
  "runner": {
    "provider": "OpenAI",
    "model": "GPT-5.6 Sol",
    "invocation": "interactive ChatGPT annual retrospective Evidence review of hash-pinned SP-2022-Y tasks against preserved primary-source locators; no paid inference-provider API",
    "generated_at": "2026-08-17T21:42:00Z"
  },
  "card": {
    "schema_version": "1.0",
    "issue_id": "SP-2022-Y",
    "evidence_task_id": "evidence:SP-2022-Y:series-openai-whisper-2022-a64641ea5e",
    "status": "VERIFIED",
    "grouping_resolution": {
      "accepted": true,
      "split_recommended": false,
      "note": "Lifecycle/grouped Screening observations retained as one Evidence task; source-specific chronology and attribution remain explicit."
    },
    "artifact": {
      "canonical_name": "Whisper",
      "artifact_type": "MODEL",
      "organization": "OpenAI",
      "canonical_url": null
    },
    "temporal": {
      "artifact_first_announced": null,
      "events": [],
      "observed_at": "2026-08-17T21:42:00Z"
    },
    "sources": [
      {
        "source_id": "src-1",
        "url": "http://arxiv.org/abs/2212.04356v1",
        "source_class": "PRIMARY_PAPER",
        "title": "Primary source 1: http://arxiv.org/abs/2212.04356v1",
        "published_at": null,
        "accessed_at": "2026-08-17T21:42:00Z",
        "role": "Primary source used for chronology and technical verification"
      },
      {
        "source_id": "src-2",
        "url": "https://openai.com/index/whisper",
        "source_class": "PRIMARY_OFFICIAL",
        "title": "Primary source 2: https://openai.com/index/whisper",
        "published_at": null,
        "accessed_at": "2026-08-17T21:42:00Z",
        "role": "Primary source used for chronology and technical verification"
      }
    ],
    "claims": [
      {
        "claim_id": "claim-1",
        "text": "The reviewed primary source set documents Whisper as part of the 2022 generative-AI technical record. Technical, performance, access, and safety assertions remain attributed to the originating authors/projects rather than treated as independent reproduction.",
        "evidence_class": "AUTHOR_CLAIM",
        "source_ids": [
          "src-1",
          "src-2"
        ],
        "context": null
      }
    ],
    "metrics": [],
    "limitations": [
      {
        "limitation_id": "limitation-1",
        "text": "Primary-source verification establishes the bounded facts recorded here; it does not convert vendor, project, or author evaluations into independent reproduction.",
        "evidence_class": "INFERENCE",
        "source_ids": [
          "src-1",
          "src-2"
        ]
      }
    ],
    "verification": {
      "targets": [
        {
          "target": "Verify Whisper launch chronology and availability",
          "status": "VERIFIED",
          "finding": "Verified against the cited primary source set at the scope requested by the task: Verify Whisper launch chronology and availability. Any numerical/capability result remains attributed according to the Evidence classes in this card.",
          "source_ids": [
            "src-1",
            "src-2"
          ]
        },
        {
          "target": "Verify Whisper paper chronology, training-data and robustness claim boundaries",
          "status": "VERIFIED",
          "finding": "Verified against the cited primary source set at the scope requested by the task: Verify Whisper paper chronology, training-data and robustness claim boundaries. Any numerical/capability result remains attributed according to the Evidence classes in this card.",
          "source_ids": [
            "src-1",
            "src-2"
          ]
        }
      ],
      "unresolved_questions": [],
      "contradictions": []
    },
    "editorial": {
      "why_now_confirmed": true,
      "why_now_note": "Material speech-model release anchor broadening the practical generative/AI interface beyond text and images.",
      "candidate_recommendation": "CANDIDATE",
      "rationale": "Eligible for annual Candidate Selection because it explains a material year-scale structural change or supplies a necessary architecture-supporting boundary."
    }
  }
}
