{
  "schema_version": "1.0",
  "issue_id": "SP-2021-Y",
  "evidence_task_id": "evidence:SP-2021-Y:item-arxiv-2112-04359v1-0001ee7f15",
  "evidence_task_sha256": "b28a873c6ffce0829e777de020659e611518d730783cad63c3c863dd8aa97228",
  "prompt_id": "primary-source-verification-v0.1",
  "prompt_sha256": "c76baafb0bfdc1d3b3f859aec7f878a43e88372690055599f7317aaba9dde08a",
  "runner": {
    "provider": "OpenAI",
    "model": "GPT-5.6 Sol",
    "invocation": "interactive ChatGPT annual retrospective Evidence review of hash-pinned SP-2021-Y tasks against preserved primary-source locators; no paid inference-provider API",
    "generated_at": "2026-08-18T23:09:00Z"
  },
  "card": {
    "schema_version": "1.0",
    "issue_id": "SP-2021-Y",
    "evidence_task_id": "evidence:SP-2021-Y:item-arxiv-2112-04359v1-0001ee7f15",
    "status": "VERIFIED",
    "grouping_resolution": {
      "accepted": true,
      "split_recommended": false,
      "note": "Grouped lifecycle evidence is accepted where the Screening duplicate group combines a paper with its first-party announcement; otherwise this is a single reviewed primary-source observation."
    },
    "artifact": {
      "canonical_name": "Ethical and social risks of harm from Language Models",
      "artifact_type": "PAPER",
      "organization": "DeepMind / authors",
      "canonical_url": "http://arxiv.org/abs/2112.04359v1"
    },
    "temporal": {
      "artifact_first_announced": null,
      "events": [],
      "observed_at": "2026-08-18T23:09:00Z"
    },
    "sources": [
      {
        "source_id": "src-1",
        "url": "http://arxiv.org/abs/2112.04359v1",
        "source_class": "PRIMARY_PAPER",
        "title": "Primary source 1: http://arxiv.org/abs/2112.04359v1",
        "published_at": null,
        "accessed_at": "2026-08-18T23:09:00Z",
        "role": "Primary source used for chronology and technical verification"
      }
    ],
    "claims": [
      {
        "claim_id": "claim-1",
        "text": "The reviewed primary-source set documents Ethical and social risks of harm from Language Models as part of the 2021 generative-AI technical record. Technical, performance, access, and safety assertions remain attributed to the originating authors/projects rather than treated as independent reproduction.",
        "evidence_class": "AUTHOR_CLAIM",
        "source_ids": [
          "src-1"
        ],
        "context": null
      }
    ],
    "metrics": [],
    "limitations": [
      {
        "limitation_id": "limitation-1",
        "text": "Primary-source verification establishes the bounded facts recorded here; it does not convert vendor, project, or author evaluations into independent reproduction.",
        "evidence_class": "INFERENCE",
        "source_ids": [
          "src-1"
        ]
      }
    ],
    "verification": {
      "targets": [
        {
          "target": "Verify chronology and claims",
          "status": "VERIFIED",
          "finding": "Verified against the cited primary source set at the scope requested by the task: Verify chronology and claims. Any numerical/capability result remains attributed according to the Evidence classes in this card.",
          "source_ids": [
            "src-1"
          ]
        }
      ],
      "unresolved_questions": [],
      "contradictions": []
    },
    "editorial": {
      "why_now_confirmed": true,
      "why_now_note": "Explicit risk taxonomy is material to the annual evaluation/risk layer.",
      "candidate_recommendation": "CANDIDATE",
      "rationale": "Eligible for annual Candidate Selection when it explains a material year-scale structural change; otherwise retained as verified supporting context."
    }
  }
}
