{
  "schema_version": "1.0",
  "issue_id": "2026-W33",
  "evidence_task_id": "evidence:2026-W33:item-arxiv-2608-10933v1-639df3c95a",
  "evidence_task_sha256": "a1ee6c81d59c394fd1713a456329b17eba7090d2eb7fe9dae86c949fa3b1cd4d",
  "prompt_id": "primary-source-verification-v0.1",
  "prompt_sha256": "c76baafb0bfdc1d3b3f859aec7f878a43e88372690055599f7317aaba9dde08a",
  "runner": {
    "provider": "OpenAI",
    "model": "GPT-5.6 Sol",
    "invocation": "interactive-primary-source-review-r3-reconciled",
    "generated_at": "2026-08-15T21:38:00+09:00"
  },
  "card": {
    "schema_version": "1.0",
    "issue_id": "2026-W33",
    "evidence_task_id": "evidence:2026-W33:item-arxiv-2608-10933v1-639df3c95a",
    "status": "PARTIAL",
    "grouping_resolution": {
      "accepted": true,
      "split_recommended": false,
      "note": "Screening grouping retained for verification; source-specific attribution remains explicit."
    },
    "artifact": {
      "canonical_name": "SafeCA: Safe Cross-Attention Localization and Regulation for Text-to-Video Jailbreak Defense",
      "artifact_type": "PAPER",
      "organization": null,
      "canonical_url": "http://arxiv.org/abs/2608.10933v1"
    },
    "temporal": {
      "artifact_first_announced": "2026-08-11T14:01:24Z",
      "events": [
        {
          "event_id": "event-1",
          "event_type": "PAPER_SUBMISSION",
          "event_date": "2026-08-11T14:01:24Z",
          "source_published_at": "2026-08-11T14:01:24Z",
          "source_ids": [
            "src-1"
          ]
        }
      ],
      "observed_at": "2026-08-15T21:38:00+09:00"
    },
    "sources": [
      {
        "source_id": "src-1",
        "url": "http://arxiv.org/abs/2608.10933v1",
        "source_class": "PRIMARY_PAPER",
        "title": "Primary source 1: http://arxiv.org/abs/2608.10933v1",
        "published_at": null,
        "accessed_at": "2026-08-15T21:38:00+09:00",
        "role": "Primary source used for chronology and technical verification"
      }
    ],
    "claims": [
      {
        "claim_id": "claim-1",
        "text": "The primary arXiv record identifies the paper titled 'SafeCA: Safe Cross-Attention Localization and Regulation for Text-to-Video Jailbreak Defense'.",
        "evidence_class": "PRIMARY_FACT",
        "source_ids": [
          "src-1"
        ],
        "context": null
      },
      {
        "claim_id": "claim-2",
        "text": "Method, metric, comparison, and performance statements in the supplied abstract remain author-reported until full-paper review.",
        "evidence_class": "AUTHOR_CLAIM",
        "source_ids": [
          "src-1"
        ],
        "context": null
      }
    ],
    "metrics": [],
    "limitations": [
      {
        "limitation_id": "limitation-1",
        "text": "This default Evidence pass verifies paper identity/chronology only and does not constitute full-paper review.",
        "evidence_class": "INFERENCE",
        "source_ids": [
          "src-1"
        ]
      },
      {
        "limitation_id": "limitation-2",
        "text": "Abstract-level benchmark or superiority statements must not be generalized beyond the authors' reported setup.",
        "evidence_class": "INFERENCE",
        "source_ids": [
          "src-1"
        ]
      }
    ],
    "verification": {
      "targets": [
        {
          "target": "Verify chronology, primary-source identity, technical claims, and overlap before selection.",
          "status": "UNRESOLVED",
          "finding": "Identity/chronology are available from arXiv, but technical-claim and overlap review remains incomplete in the default pass.",
          "source_ids": []
        }
      ],
      "unresolved_questions": [
        "Does full-paper review support promotion beyond Paper Watch/HOLD after cross-candidate comparison?"
      ],
      "contradictions": []
    },
    "editorial": {
      "why_now_confirmed": true,
      "why_now_note": "The arXiv record falls inside the 2026-W33 discovery window, but the default pass is abstract-level only; headline use requires paper-level method/setup review.",
      "candidate_recommendation": "HOLD",
      "rationale": "Retain as a paper-level lead while preserving the boundary between abstract screening and verified technical evidence."
    }
  }
}
