{
  "schema_version": "1.0",
  "issue_id": "SP-2024-H2",
  "evidence_task_id": "evidence:SP-2024-H2:item-official-feed-10b59b402b80208a6b65-e1b323636e",
  "evidence_task_sha256": "c23df91c16ec21ba7239cc0aa7ab05fc4423d8f5e4a8b41bcabe8fd474b16a83",
  "prompt_id": "primary-source-verification-v0.1",
  "prompt_sha256": "c76baafb0bfdc1d3b3f859aec7f878a43e88372690055599f7317aaba9dde08a",
  "runner": {
    "provider": "OpenAI",
    "model": "GPT-5.6 Sol",
    "invocation": "interactive ChatGPT project review of hash-pinned SP-2024-H2 Evidence Tasks against preserved primary-source locators and current primary-source pages; no paid inference-provider API",
    "generated_at": "2026-08-14T13:35:00Z"
  },
  "card": {
    "schema_version": "1.0",
    "issue_id": "SP-2024-H2",
    "evidence_task_id": "evidence:SP-2024-H2:item-official-feed-10b59b402b80208a6b65-e1b323636e",
    "status": "VERIFIED",
    "grouping_resolution": {
      "accepted": true,
      "split_recommended": false,
      "note": "Screening grouping retained for verification; source-specific attribution remains explicit."
    },
    "artifact": {
      "canonical_name": "Introducing SWE-bench Verified",
      "artifact_type": "BENCHMARK",
      "organization": "OpenAI",
      "canonical_url": "https://openai.com/index/introducing-swe-bench-verified"
    },
    "temporal": {
      "artifact_first_announced": "2024-08-13",
      "events": [
        {
          "event_id": "event-1",
          "event_type": "BENCHMARK_RELEASE",
          "event_date": "2024-08-13",
          "source_published_at": null,
          "source_ids": [
            "src-1"
          ]
        }
      ],
      "observed_at": "2026-08-14T13:35:00Z"
    },
    "sources": [
      {
        "source_id": "src-1",
        "url": "https://openai.com/index/introducing-swe-bench-verified",
        "source_class": "PRIMARY_OFFICIAL",
        "title": "Primary source 1: https://openai.com/index/introducing-swe-bench-verified",
        "published_at": null,
        "accessed_at": "2026-08-14T13:35:00Z",
        "role": "Primary source used for chronology and technical verification"
      }
    ],
    "claims": [
      {
        "claim_id": "claim-1",
        "text": "Primary source(s) document Introducing SWE-bench Verified within SP-2024-H2; numerical and capability claims remain attributed.",
        "evidence_class": "PRIMARY_FACT",
        "source_ids": [
          "src-1"
        ],
        "context": null
      }
    ],
    "metrics": [],
    "limitations": [
      {
        "limitation_id": "limitation-1",
        "text": "Primary-source verification establishes the bounded facts recorded here; it does not convert vendor, project, or author evaluations into independent reproduction.",
        "evidence_class": "INFERENCE",
        "source_ids": [
          "src-1"
        ]
      }
    ],
    "verification": {
      "targets": [
        {
          "target": "verify Aug 13 date, benchmark curation/evaluation scope and claims",
          "status": "VERIFIED",
          "finding": "Verified against the cited primary source set at the scope requested by the task: verify Aug 13 date, benchmark curation/evaluation scope and claims. Any numerical/capability result remains attributed according to the Evidence classes in this card.",
          "source_ids": [
            "src-1"
          ]
        }
      ],
      "unresolved_questions": [],
      "contradictions": []
    },
    "editorial": {
      "why_now_confirmed": true,
      "why_now_note": "action, tool use, search, and execution-surface evolution",
      "candidate_recommendation": "CANDIDATE",
      "rationale": "Eligible for half-year Candidate Selection; final editorial role is decided at Selection."
    }
  }
}
