{
  "schema_version": "1.0",
  "issue_id": "SP-2026-M01",
  "evidence_task_id": "evidence:SP-2026-M01:item-official-index-zai-release-notes-409a030c15",
  "evidence_task_sha256": "8e3c9da40e174cf01c77d64280a6d908e8b16c3760be574096c000650d57f74f",
  "prompt_id": "primary-source-verification-v0.1",
  "prompt_sha256": "c76baafb0bfdc1d3b3f859aec7f878a43e88372690055599f7317aaba9dde08a",
  "runner": {
    "provider": "OpenAI",
    "model": "GPT-5.6 Sol",
    "invocation": "interactive ChatGPT project primary-source Evidence review using preserved Source Intake material and first-party item-level verification; no paid inference-provider API",
    "generated_at": "2026-08-13T04:49:00Z",
    "run_reference": "January 2026 Special primary-source Evidence review"
  },
  "card": {
    "schema_version": "1.0",
    "issue_id": "SP-2026-M01",
    "evidence_task_id": "evidence:SP-2026-M01:item-official-index-zai-release-notes-409a030c15",
    "status": "VERIFIED",
    "grouping_resolution": {
      "accepted": true,
      "split_recommended": false,
      "note": "Screening grouping retained for verification; source-specific attribution remains explicit."
    },
    "artifact": {
      "canonical_name": "GLM-4.7-Flash and GLM-Image",
      "artifact_type": "MODEL_UPDATE",
      "organization": "Z.ai",
      "canonical_url": "https://docs.z.ai/release-notes/new-released"
    },
    "temporal": {
      "artifact_first_announced": "2026-01-14",
      "events": [
        {
          "event_id": "event-1",
          "event_type": "MODEL_RELEASE",
          "event_date": "2026-01-14",
          "source_published_at": null,
          "source_ids": [
            "src-1"
          ]
        },
        {
          "event_id": "event-2",
          "event_type": "MODEL_RELEASE",
          "event_date": "2026-01-19",
          "source_published_at": null,
          "source_ids": [
            "src-1"
          ]
        }
      ],
      "observed_at": "2026-08-13T04:49:00Z"
    },
    "sources": [
      {
        "source_id": "src-1",
        "url": "https://docs.z.ai/release-notes/new-released",
        "source_class": "PRIMARY_OFFICIAL",
        "title": "Primary source 1: https://docs.z.ai/release-notes/new-released",
        "published_at": null,
        "accessed_at": "2026-08-13T04:49:00Z",
        "role": "Primary source used for chronology and technical verification"
      }
    ],
    "claims": [
      {
        "claim_id": "claim-1",
        "text": "Z.ai release notes record GLM-Image on January 14, described as combining autoregressive semantic understanding with diffusion-based decoding for controllable image generation.",
        "evidence_class": "PRIMARY_FACT",
        "source_ids": [
          "src-1"
        ],
        "context": null
      },
      {
        "claim_id": "claim-2",
        "text": "Z.ai release notes record GLM-4.7-Flash on January 19 as a lightweight/free-tier GLM-4.7 variant for coding, reasoning, and generative tasks.",
        "evidence_class": "PRIMARY_FACT",
        "source_ids": [
          "src-1"
        ],
        "context": null
      },
      {
        "claim_id": "claim-3",
        "text": "Comparative quality, latency, throughput, and ‘best-in-class’ language in the release notes are vendor claims.",
        "evidence_class": "VENDOR_CLAIM",
        "source_ids": [
          "src-1"
        ],
        "context": null
      }
    ],
    "metrics": [],
    "limitations": [
      {
        "limitation_id": "limitation-1",
        "text": "The task groups two distinct model releases because both establish the January Z.ai model line; drafting should not imply a single architecture.",
        "evidence_class": "INFERENCE",
        "source_ids": [
          "src-1"
        ]
      },
      {
        "limitation_id": "limitation-2",
        "text": "Performance claims are vendor-reported and not independently reproduced.",
        "evidence_class": "INFERENCE",
        "source_ids": [
          "src-1"
        ]
      }
    ],
    "verification": {
      "targets": [
        {
          "target": "extract January GLM releases; verify exact date, parameter/model identity, coding/agent scope, open-weight/license status, availability, and benchmark attribution",
          "status": "VERIFIED",
          "finding": "Verified against the cited primary source set at the scope requested by the task: extract January GLM releases; verify exact date, parameter/model identity, coding/agent scope, open-weight/license status, availability, and benchmark attribution. Any numerical/capability result remains attributed according to the Evidence classes in this card.",
          "source_ids": [
            "src-1"
          ]
        }
      ],
      "unresolved_questions": [],
      "contradictions": []
    },
    "editorial": {
      "why_now_confirmed": true,
      "why_now_note": "Provides a compact open/lightweight model counterpoint to agent-system releases and links directly to same-month runtime support in SGLang/Transformers.",
      "candidate_recommendation": "CANDIDATE",
      "rationale": "Primary-source evidence supports Candidate Selection for a material January 2026 technical change."
    }
  }
}
