{
  "schema_version": "1.0",
  "issue_id": "2026-W33",
  "evidence_task_id": "evidence:2026-W33:item-official-index-nvidia-generative-ai-3190b19a6d",
  "evidence_task_sha256": "07a99e6334be620d56a72d374b154ba44c5c845ff946ef2050464601bb2086a8",
  "prompt_id": "primary-source-verification-v0.1",
  "prompt_sha256": "c76baafb0bfdc1d3b3f859aec7f878a43e88372690055599f7317aaba9dde08a",
  "runner": {
    "provider": "OpenAI",
    "model": "GPT-5.6 Sol",
    "invocation": "interactive-primary-source-review-openai-carryover-correction",
    "generated_at": "2026-08-15T22:15:00+09:00"
  },
  "card": {
    "schema_version": "1.0",
    "issue_id": "2026-W33",
    "evidence_task_id": "evidence:2026-W33:item-official-index-nvidia-generative-ai-3190b19a6d",
    "status": "NEEDS_MORE",
    "grouping_resolution": {
      "accepted": true,
      "split_recommended": false,
      "note": "Screening grouping retained for verification; source-specific attribution remains explicit."
    },
    "artifact": {
      "canonical_name": "nvidia-generative-ai-blog",
      "artifact_type": "OTHER",
      "organization": null,
      "canonical_url": "https://blogs.nvidia.com/blog/tag/generative-ai/"
    },
    "temporal": {
      "artifact_first_announced": null,
      "events": [],
      "observed_at": "2026-08-15T22:15:00+09:00"
    },
    "sources": [
      {
        "source_id": "src-1",
        "url": "https://blogs.nvidia.com/blog/tag/generative-ai/",
        "source_class": "PRIMARY_OFFICIAL",
        "title": "Primary source 1: https://blogs.nvidia.com/blog/tag/generative-ai/",
        "published_at": null,
        "accessed_at": "2026-08-15T22:15:00+09:00",
        "role": "Primary source used for chronology and technical verification"
      }
    ],
    "claims": [
      {
        "claim_id": "claim-1",
        "text": "The captured official index is a discovery source; the index snapshot alone is not item-level technical evidence.",
        "evidence_class": "PRIMARY_FACT",
        "source_ids": [
          "src-1"
        ],
        "context": null
      }
    ],
    "metrics": [],
    "limitations": [
      {
        "limitation_id": "limitation-1",
        "text": "No concrete item-level W33 event has been established from this index task.",
        "evidence_class": "INFERENCE",
        "source_ids": [
          "src-1"
        ]
      },
      {
        "limitation_id": "limitation-2",
        "text": "Do not infer a product/model release merely from the presence of the organization index in Source Intake.",
        "evidence_class": "INFERENCE",
        "source_ids": [
          "src-1"
        ]
      }
    ],
    "verification": {
      "targets": [
        {
          "target": "Inspect the underlying official index and identify concrete W33 items before verification.",
          "status": "UNRESOLVED",
          "finding": "Item-level source inspection is still required before this index can affect Candidate Selection.",
          "source_ids": []
        }
      ],
      "unresolved_questions": [
        "Which concrete item, if any, from this official index belongs in the W33 editorial window?"
      ],
      "contradictions": []
    },
    "editorial": {
      "why_now_confirmed": false,
      "why_now_note": "The official index snapshot is preserved in 2026-W33, but this task does not identify an item-level event that can support a standalone technical claim.",
      "candidate_recommendation": "INSPECT_MORE",
      "rationale": "Preserve the source for targeted inspection; do not promote an index page itself as a candidate."
    }
  }
}
