{"schema_version":"1.0","issue_id":"SP-automotive-ee-architecture-2023-2026","evidence_task_id":"evidence:SP-automotive-ee-architecture-2023-2026:item-arxiv-2407-17287v2-e9ad789af2","evidence_task_sha256":"9e3af5201e4468a85284a97d62e65388e1ceafc758c3902947f1698dd5aad108","prompt_id":"primary-source-verification-v0.1","prompt_sha256":"69fe1c7015ebc4f85c69a86b029575ee18551bcfbf25ea93c146684789bfaf8a","runner":{"provider":"openai","model":"GPT-5.6 Sol","invocation":"interactive Automotive E/E Evidence batch-03 primary-source verification","generated_at":"2026-08-18T14:58:00Z","run_reference":"experiment/automotive-ee-architecture-special"},"card":{"schema_version":"1.0","issue_id":"SP-automotive-ee-architecture-2023-2026","evidence_task_id":"evidence:SP-automotive-ee-architecture-2023-2026:item-arxiv-2407-17287v2-e9ad789af2","status":"VERIFIED","grouping_resolution":{"accepted":true,"split_recommended":false,"note":"Single paper; no grouping ambiguity."},"artifact":{"canonical_name":"Deterministic and Reliable Software-Defined Vehicles: key building blocks, challenges, and vision","artifact_type":"PAPER","organization":"University of Aveiro / Instituto de Telecomunicações","canonical_url":"https://arxiv.org/abs/2407.17287"},"temporal":{"artifact_first_announced":"2024-07-24T13:56:56Z","observed_at":"2026-08-18T14:58:00Z","events":[{"event_id":"event-arxiv-v1","event_type":"PREPRINT_SUBMISSION","event_date":"2024-07-24T13:56:56Z","source_published_at":"2024-07-24T13:56:56Z","source_ids":["src-paper"]},{"event_id":"event-arxiv-v2","event_type":"PREPRINT_REVISION","event_date":"2025-01-09T10:13:51Z","source_published_at":"2025-01-09T10:13:51Z","source_ids":["src-paper"]}]},"sources":[{"source_id":"src-paper","url":"https://arxiv.org/abs/2407.17287","source_class":"PRIMARY_PAPER","title":"Deterministic and Reliable Software-Defined Vehicles: key building blocks, challenges, and vision","published_at":"2025-01-09T10:13:51Z","accessed_at":"2026-08-18T14:58:00Z","role":"Author paper/preprint used to verify the reported architecture, method/evaluation scope, material claims, and limitations available in the primary text."}],"claims":[{"claim_id":"claim-scope","text":"The paper surveys deterministic SDV development around service-oriented architectures, virtualization, and deterministic intra- and inter-vehicle communications.","evidence_class":"AUTHOR_CLAIM","source_ids":["src-paper"],"context":"Survey/tutorial scope."},{"claim_id":"claim-architecture-transition","text":"The authors describe SDV compute as moving from many distributed ECUs toward more centralized computing combined with zone-based architecture, while emphasizing deterministic network and compute guarantees for critical services.","evidence_class":"AUTHOR_CLAIM","source_ids":["src-paper"],"context":"Literature synthesis and author framing, not an independent fleet measurement."},{"claim_id":"claim-vision","text":"The proposed vision architecture contains five coordinating elements: deterministic network configurator, data-layer configurator, hypervisor configurator, vehicle abstraction layer, and software orchestrator.","evidence_class":"AUTHOR_CLAIM","source_ids":["src-paper"],"context":"Proposed vision rather than deployed production architecture."}],"metrics":[],"limitations":[{"limitation_id":"limitation-vision","text":"The five-component architecture is a survey-derived vision; the paper discusses validation paths rather than establishing production deployment or end-to-end certification of the complete architecture.","evidence_class":"AUTHOR_CLAIM","source_ids":["src-paper"]},{"limitation_id":"limitation-secondary-synthesis","text":"Many architecture-transition statements synthesize cited literature and industry material and should not be treated as independently measured facts from this paper.","evidence_class":"INFERENCE","source_ids":["src-paper"]}],"verification":{"targets":[{"target":"Verify the architecture, evaluation setup, material claims and limitations reported for Deterministic and Reliable Software-Defined Vehicles: key building blocks, challenges, and vision; preserve paper results as AUTHOR_CLAIM unless independently established.","status":"VERIFIED","finding":"The v2 primary paper verifies the survey scope, centralized/zonal SDV framing, deterministic service requirements, and the five-part vision architecture; these remain literature synthesis/author proposals rather than empirical production validation.","source_ids":["src-paper"]}],"unresolved_questions":[],"contradictions":[]},"editorial":{"why_now_confirmed":true,"why_now_note":"It connects compute centralization, zonal topology, SOA, virtualization and deterministic networking into one coherent architectural responsibility model during the survey window.","candidate_recommendation":"CANDIDATE","rationale":"Useful synthesis/vision evidence for architecture framing, with clear separation between surveyed facts and the authors' proposed orchestration architecture."}}}