{"schema_version":"1.0","issue_id":"SP-automotive-ee-architecture-2023-2026","evidence_task_id":"evidence:SP-automotive-ee-architecture-2023-2026:item-official-index-open-alliance-channe-8482a0781d","evidence_task_sha256":"290c97979a947c98794f21cb394c5c7b3fb1f26f6e9b2378b3ba84bf6044c7a9","prompt_id":"primary-source-verification-v0.1","prompt_sha256":"69fe1c7015ebc4f85c69a86b029575ee18551bcfbf25ea93c146684789bfaf8a","runner":{"provider":"openai","model":"GPT-5.6 Sol","invocation":"interactive Automotive E/E Evidence batch-02 primary-source verification","generated_at":"2026-08-18T14:40:00Z","run_reference":"experiment/automotive-ee-architecture-special"},"card":{"schema_version":"1.0","issue_id":"SP-automotive-ee-architecture-2023-2026","evidence_task_id":"evidence:SP-automotive-ee-architecture-2023-2026:item-official-index-open-alliance-channe-8482a0781d","status":"VERIFIED","grouping_resolution":{"accepted":true,"split_recommended":false,"note":"Single item-level primary source; no grouping ambiguity."},"artifact":{"canonical_name":"OPEN Alliance TC9 Automotive Ethernet Channel & Components specifications","artifact_type":"SPECIFICATION","organization":"OPEN Alliance","canonical_url":"https://opensig.org/tech-committee/tc9-automotive-ethernet-channel-components/"},"temporal":{"artifact_first_announced":"2025-06","observed_at":"2026-08-18T14:40:00Z","events":[{"event_id":"event-10base-channel-v11","event_type":"SPECIFICATION_RELEASE","event_date":"2025-06","source_published_at":null,"source_ids":["src-open"]}]},"sources":[{"source_id":"src-open","url":"https://opensig.org/tech-committee/tc9-automotive-ethernet-channel-components/","source_class":"PRIMARY_OFFICIAL","title":"TC9 – Automotive Ethernet Channel & Components","published_at":null,"accessed_at":"2026-08-18T14:40:00Z","role":"Official OPEN Alliance committee page used for cabling/channel requirements, test methodology scope and current focus."}],"claims":[{"claim_id":"claim-scope","text":"TC9 defines electrical requirements and test procedures for automotive Ethernet cabling channels and components, including cables, connectors and assemblies aligned with IEEE 802.3 link-segment requirements.","evidence_class":"PRIMARY_FACT","source_ids":["src-open"],"context":"Committee scope."},{"claim_id":"claim-speed-grades","text":"The committee states that its work covers automotive Ethernet speed grades on electrical media and develops generic measurement/test procedures for link-segment and component qualification.","evidence_class":"PRIMARY_FACT","source_ids":["src-open"],"context":"Public scope statement."},{"claim_id":"claim-current-focus","text":"The pinned page states current work includes 1000BASE-T1 over coaxial media and 25GBASE-T1, while the roadmap lists 10BASE-T1S channel/component requirements v1.1 from June 2025.","evidence_class":"PRIMARY_FACT","source_ids":["src-open"],"context":"Roadmap/current-focus snapshot."}],"metrics":[],"limitations":[{"limitation_id":"lim-physical-layer","text":"This page verifies channel/component specification activity and versions, not electrical performance of any particular production harness or connector implementation.","evidence_class":"INFERENCE","source_ids":["src-open"]}],"verification":{"targets":[{"target":"Verify the official scope/status and architecture-significant statements on open-alliance-channel-components; distinguish directly checkable facts from organization/project claims.","status":"VERIFIED","finding":"The official page establishes physical-channel/component responsibilities and test methodology spanning multiple Automotive Ethernet media/speeds.","source_ids":["src-open"]}],"unresolved_questions":[],"contradictions":[]},"editorial":{"why_now_confirmed":true,"why_now_note":"Physical link/channel specifications are an often-hidden but essential constraint on the move to Ethernet-centric zonal/backbone architectures.","candidate_recommendation":"CANDIDATE","rationale":"Strong supporting candidate for the physical-network layer, especially to prevent the survey from treating Ethernet as a purely logical/software transition."}}}